<?xml version="1.0" encoding="UTF-8"?>
<!DOCTYPE configuration
		PUBLIC "-//mybatis.org//DTD Config 4.0//EN"
		"http://mybatis.org/dtd/mybatis-4-config.dtd">
<configuration application="rtomde">

	<typeAliases>
		<typeAlias alias="HashMap" type="java.util.HashMap" />
		<typeAlias alias="LinkedHashMap" type="java.util.LinkedHashMap" />
		<typeAlias alias="ArrayList" type="java.util.ArrayList" />
		<typeAlias alias="LinkedList" type="java.util.LinkedList" />
	</typeAliases>

	<environments default="local">
		<environment id="local">
			<dataSource id="rtomde" type="HIKARICP">
				<property name="driver" value="com.mysql.cj.jdbc.Driver"/>
				<property name="url" value="jdbc:mysql://localhost:3306/rtomde"/>
				<property name="username" value="root"/>
				<property name="password" value="123"/>
			</dataSource>
			<lettuce id="rtomode" type="standalone">
				<property name="host" value="localhost"/>
				<property name="port" value="6379"/>
				<property name="password" value="123"/>
				<property name="database" value="0"/>
				<property name="timeout" value="1000"/>
			</lettuce>
		</environment>
		<environment id="dev">
			<dataSource id="rtomde" type="HIKARICP">
				<property name="driver" value="com.mysql.cj.jdbc.Driver"/>
				<property name="url" value="jdbc:mysql://test-xc-dev.mysql.rds.aliyuncs.com:3331/data_service"/>
				<property name="username" value="test_xc_dev"/>
				<property name="password" value="x!c@_d#ev$xcD_SdeAvM"/>
			</dataSource>
			<lettuce id="rtomode" type="standalone">
				<property name="host" value="localhost"/>
				<property name="port" value="6379"/>
				<property name="password" value="123"/>
				<property name="database" value="0"/>
				<property name="timeout" value="1000"/>
			</lettuce>
		</environment>
	</environments>

	<mappers>
		<mapper url="file:/Users/wangqi/Documents/git_repository/rtomde/rtomde-service/rtomde-service-dubbo/src/main/resources/mapper/SysUserMapper.xml"/>
	</mappers>
</configuration>